{
  "schemaVersion": 1,
  "kind": "crop_pack",
  "id": "walnut_blight",
  "version": "0.1.0",
  "label": "Walnut blight",
  "blurb": "Blight Risk (Ji forecast/historical + sandbox), orchard inoculum, and research modifiers.",
  "category": "crop",
  "modules": ["blight"],
  "settingsDocId": "model_params",
  "settingsOwnedKeys": [
    "orchardInoculumLevel",
    "budbreakMonth",
    "budbreakDay",
    "blightSensitivity",
    "cropCoefficient",
    "gddBaseTemp",
    "humidityGradientFactor",
    "splashMultiplier",
    "chemRainWashoffRate",
    "bioColonizationEff",
    "bioFavorableGrowthRate",
    "bioEnvDegradationCoef",
    "springStartingInoculum",
    "latencyGDDThreshold",
    "secondarySpreadMultiplier",
    "treeHeight",
    "canopyWidth",
    "rowSpacing",
    "chemEfficacy",
    "bioEfficacy"
  ],
  "primaryPath": "/blight",
  "author": "PUF-AM",
  "license": "MIT"
}
