{
  "schemaVersion": 1,
  "kind": "crop_pack",
  "id": "wheat_yield",
  "version": "0.1.0",
  "label": "Crop assessment",
  "blurb": "Wheat paddock yield from head counts, and harvest loss from drop trays under the header.",
  "category": "crop",
  "modules": ["wheat"],
  "settingsDocId": null,
  "primaryPath": "/wheat-yield",
  "author": "PUF-AM",
  "license": "MIT"
}
